{
  "schema_version": "1.0",

  "dataset": {
    "id": "qinghe-chapter-1-v1",
    "title": "燕云十六声·第一章·神仙不渡 剧情数据",
    "game": "燕云十六声",
    "language": "zh-CN",
    "collected_at": "2026-06-08",
    "content_scope": "第一章·神仙不渡（清河区域）四篇主线剧情：又见新来燕、匹马映林嘶、菱花尘满、为谁归去。含序章回忆。不含支线任务、奇遇、侠迹卷及后续章节。",
    "disclaimer": "本数据集为非官方整理的剧情资料，仅供剧情梳理参考，不代表官方设定。部分信息基于社区分析，已标注置信度。"
  },

  "chapters": [
    {
      "id": "chapter-qinghe",
      "slug": "qinghe",
      "title": "第一章·神仙不渡",
      "region": "清河",
      "sort_order": 0,
      "progress_key": "qinghe",
      "progress_rank": 10,
      "summary": "主角是养父江晏保护下长大的遗孤。遭黑衣人袭击夺走玉佩后，在周红线陪伴下踏上追寻真相之路。主角在清河学武、寻亲、回到神仙渡与养母寒香寻重逢，经历不羡仙大火后与侠客伊刀并肩救人，最终告别清河前往开封。明线为主角寻亲与成长，暗线为绣金楼追杀、田英抗辽与各方势力角力。",
      "source_ids": ["src-3dm-qinghe", "src-ali213-all"]
    }
  ],

  "factions": [
    {
      "id": "xiu-jin-lou",
      "slug": "xiu-jin-lou",
      "name": "绣金楼",
      "faction_type": "暗势力",
      "summary": "神秘杀手组织。十六年前江晏被迫从此逃离，携婴儿与镇冠珏出逃。后续曾派三路势力来袭清河：抓寒香寻以获取契丹卧底名单、寻田英、找主角。",
      "spoiler_level": 1,
      "visible_after_progress": "qinghe",
      "source_ids": ["src-17173-analysis"]
    },
    {
      "id": "shen-xian-du",
      "slug": "shen-xian-du",
      "name": "神仙渡",
      "faction_type": "据点",
      "summary": "寒香寻经营的渡口，核心场所为不羡仙酒馆。主角曾在此生活，是清河地区的重要据点。",
      "spoiler_level": 0,
      "visible_after_progress": "start",
      "source_ids": ["src-3dm-qinghe"]
    },
    {
      "id": "wu-xiang-men",
      "slug": "wu-xiang-men",
      "name": "无相门",
      "faction_type": "神秘势力",
      "summary": "序章中出现的势力，无相皇为代表。在序章中与江晏交战，当时无相皇处于被控制状态。",
      "spoiler_level": 1,
      "visible_after_progress": "qinghe",
      "source_ids": ["src-17173-analysis"]
    },
    {
      "id": "tian-quan",
      "slug": "tian-quan",
      "name": "天泉",
      "faction_type": "门派",
      "summary": "武林门派之一，以陌刀为武器，肉盾防御型。江晏原为天泉弟子，后叛离。",
      "spoiler_level": 1,
      "visible_after_progress": "qinghe",
      "source_ids": ["src-3dm-qinghe"]
    },
    {
      "id": "hou-jin",
      "slug": "hou-jin",
      "name": "后晋军队",
      "faction_type": "历史势力",
      "summary": "五代十国时期后晋王朝的军队。将军王清在公元945年中渡桥之战中遭叛徒杜政出卖身亡，是序章的历史背景。",
      "spoiler_level": 0,
      "visible_after_progress": "start",
      "source_ids": ["src-17173-analysis"]
    },
    {
      "id": "xuan-jian",
      "slug": "xuan-jian",
      "name": "悬剑",
      "faction_type": "刺客组织",
      "summary": "刺客组织。田英为其神级刺客，一人北上契丹执行任务，寻回文津馆绝学《十相之书》。清河暗线的核心势力。",
      "spoiler_level": 2,
      "visible_after_progress": "current",
      "source_ids": ["src-17173-tianying", "src-17173-analysis"]
    }
  ],

  "characters": [
    {
      "id": "protagonist",
      "slug": "protagonist",
      "name": "主角",
      "aliases": ["少东家"],
      "summary": "从小被养父江晏保护长大的遗孤，心里向往江湖生活。十六岁时遭黑衣人袭击，镇冠珏被夺。",
      "interpretation": "江晏不惜一切从绣金楼带出的婴儿，暗示主角身份极为特殊，身世之谜是贯穿全剧的核心悬念。",
      "identity_tags": ["遗孤", "江湖新人", "清河线"],
      "faction_id": null,
      "importance": 5,
      "spoiler_level": 0,
      "first_appear_chapter_id": "chapter-qinghe",
      "visible_after_progress": "start",
      "source_ids": ["src-3dm-qinghe", "src-ali213-all"]
    },
    {
      "id": "zhou-hongxian",
      "slug": "zhou-hongxian",
      "name": "周红线",
      "aliases": [],
      "summary": "竹林旧居附近的少女，性格活泼正义、刚烈嫉恶。",
      "interpretation": null,
      "identity_tags": ["青梅竹马", "引导者", "清河线"],
      "faction_id": null,
      "importance": 5,
      "spoiler_level": 0,
      "first_appear_chapter_id": "chapter-qinghe",
      "visible_after_progress": "qinghe",
      "source_ids": ["src-3dm-qinghe", "src-ali213-all"]
    },
    {
      "id": "jiang-yan",
      "slug": "jiang-yan",
      "name": "江晏",
      "aliases": ["江无浪", "江叔"],
      "summary": "主角的养父。十六年前携婴儿（主角）和镇冠珏从绣金楼出逃，隐姓埋名抚养主角。三年前突然失踪，后蒙面归来夺走玉佩，引发主角踏上旅途。序章中在绝境中领悟武学，击败无相皇。",
      "interpretation": "江晏的行为暗示他知晓主角身世的重大秘密。三年后归来夺玉的真实动机是第一章最大悬念。",
      "identity_tags": ["养父", "高手", "通缉犯"],
      "faction_id": null,
      "importance": 5,
      "spoiler_level": 1,
      "first_appear_chapter_id": "chapter-qinghe",
      "visible_after_progress": "qinghe",
      "source_ids": ["src-17173-analysis", "src-dailiantong-main"],
      "review_note": "江晏原为天泉弟子，后与绣金楼有关联并从中出逃，当前为逃亡状态，无明确势力归属。多重归属写于summary中。"
    },
    {
      "id": "han-xiangxun",
      "slug": "han-xiangxun",
      "name": "寒香寻",
      "aliases": ["寒姨"],
      "summary": "神仙渡不羡仙酒馆的女老板，主角的养母。第一篇中通过信件和灵位被提及，第二篇在不羡仙正面出场与主角重逢。表面经营酒馆，实则身份复杂。",
      "interpretation": "寒香寻的多重身份暗示清河故事暗流涌动。信件和灵位是揭开其真实身份的第一块拼图。",
      "identity_tags": ["养母", "酒馆老板", "清河线"],
      "faction_id": "shen-xian-du",
      "importance": 5,
      "spoiler_level": 1,
      "first_appear_chapter_id": "chapter-qinghe",
      "visible_after_progress": "qinghe",
      "source_ids": ["src-3dm-qinghe", "src-17173-analysis"],
      "review_note": "别名'洛神'为其隐藏身份，未放入aliases以避免在低等级暴露。"
    },
    {
      "id": "yi-dao",
      "slug": "yi-dao",
      "name": "伊刀",
      "aliases": ["刀哥"],
      "summary": "江湖侠客。第二篇末尾主角在寒姨房间遇刺杀时邂逅伊刀，两人推石门、战黑衣人。第四篇中与主角在破庙汇合，一同回不羡仙救人、在酒香塔并肩作战。",
      "interpretation": null,
      "identity_tags": ["侠客", "同伴", "清河线"],
      "faction_id": null,
      "importance": 4,
      "spoiler_level": 1,
      "first_appear_chapter_id": "chapter-qinghe",
      "visible_after_progress": "qinghe",
      "source_ids": ["src-3dm-qinghe", "src-17173-analysis"]
    },
    {
      "id": "chen-zixi",
      "slug": "chen-zixi",
      "name": "陈子奚",
      "aliases": [],
      "summary": "与江晏同行的义士，在序章中护送婴儿（主角）逃离绣金楼。穷途末路中仍与江晏对饮，是江晏的知己。在逃亡途中为主角挡刀。",
      "interpretation": "陈子奚的行为奠定了故事'乱世忠义'的基调，为保护主角，身边人甘愿付出生命。",
      "identity_tags": ["义士", "书生", "清河线"],
      "faction_id": null,
      "importance": 4,
      "spoiler_level": 1,
      "first_appear_chapter_id": "chapter-qinghe",
      "visible_after_progress": "qinghe",
      "source_ids": ["src-17173-analysis", "src-dailiantong-main"]
    },
    {
      "id": "black-clothed-man",
      "slug": "black-clothed-man",
      "name": "黑衣人",
      "aliases": [],
      "summary": "在主角十六岁时突然袭击，目标不是主角性命而是玉佩（镇冠珏）。袭击后主角昏迷。",
      "interpretation": "黑衣人'不要命只要玉'的行为暗示镇冠珏比主角的命更重要，或黑衣人不忍伤害主角。",
      "identity_tags": ["袭击者", "清河线"],
      "faction_id": null,
      "importance": 3,
      "spoiler_level": 0,
      "first_appear_chapter_id": "chapter-qinghe",
      "visible_after_progress": "start",
      "source_ids": ["src-3dm-qinghe", "src-dailiantong-main"],
      "review_note": "黑衣人身份和所属势力在第一章中未揭露，faction_id设为null。"
    },
    {
      "id": "wuxiang-huang",
      "slug": "wuxiang-huang",
      "name": "无相皇",
      "aliases": [],
      "summary": "序章中与江晏交战的对手。当时处于被控制状态，江晏在绝境中领悟武学将其击败。",
      "interpretation": "无相皇被控制的状态暗示背后有更大的势力在操纵。",
      "identity_tags": ["敌对势力首领"],
      "faction_id": "wu-xiang-men",
      "importance": 3,
      "spoiler_level": 1,
      "first_appear_chapter_id": "chapter-qinghe",
      "visible_after_progress": "qinghe",
      "source_ids": ["src-17173-analysis"]
    },
    {
      "id": "qianye",
      "slug": "qianye",
      "name": "千夜",
      "aliases": [],
      "summary": "第四篇中在酒香塔内与主角交战的对手。主角将其击败后带同伴回到神仙渡。",
      "interpretation": null,
      "identity_tags": ["敌对角色"],
      "faction_id": null,
      "importance": 3,
      "spoiler_level": 1,
      "first_appear_chapter_id": "chapter-qinghe",
      "visible_after_progress": "qinghe",
      "source_ids": ["src-ali213-all"]
    },
    {
      "id": "feng-jisheng",
      "slug": "feng-jisheng",
      "name": "冯继升",
      "aliases": [],
      "summary": "清河隐月山附近的射箭师。主角在北竹林与之比试射箭并获胜，习得射术奇术。",
      "interpretation": null,
      "identity_tags": ["射箭师"],
      "faction_id": null,
      "importance": 3,
      "spoiler_level": 0,
      "first_appear_chapter_id": "chapter-qinghe",
      "visible_after_progress": "qinghe",
      "source_ids": ["src-3dm-qinghe"]
    },
    {
      "id": "tianya-ke",
      "slug": "tianya-ke",
      "name": "天涯客",
      "aliases": [],
      "summary": "百草野遇到的流浪者，赠予主角舆图帮助探索清河地区。",
      "interpretation": null,
      "identity_tags": ["流浪者"],
      "faction_id": null,
      "importance": 3,
      "spoiler_level": 0,
      "first_appear_chapter_id": "chapter-qinghe",
      "visible_after_progress": "qinghe",
      "source_ids": ["src-3dm-qinghe"]
    },
    {
      "id": "fang-xu",
      "slug": "fang-xu",
      "name": "方旭",
      "aliases": [],
      "summary": "将军祠附近的可结交角色。在将军祠擂台相关剧情中出现。",
      "interpretation": null,
      "identity_tags": ["清河NPC"],
      "faction_id": null,
      "importance": 3,
      "spoiler_level": 0,
      "first_appear_chapter_id": "chapter-qinghe",
      "visible_after_progress": "qinghe",
      "source_ids": ["src-ali213-all"]
    },
    {
      "id": "guang-huzi",
      "slug": "guang-huzi",
      "name": "广胡子",
      "aliases": ["光胡子"],
      "summary": "第一篇结尾与主角和红线对话的角色。贯穿清河四篇的配角。",
      "interpretation": null,
      "identity_tags": ["配角", "清河线"],
      "faction_id": null,
      "importance": 3,
      "spoiler_level": 0,
      "first_appear_chapter_id": "chapter-qinghe",
      "visible_after_progress": "qinghe",
      "source_ids": ["src-3dm-qinghe", "src-ali213-all"],
      "review_note": "部分来源记为'光胡子'，疑为同一人的不同写法。以'广胡子'为规范名，'光胡子'列入aliases。"
    },
    {
      "id": "shou-laodi",
      "slug": "shou-laodi",
      "name": "瘦老弟",
      "aliases": ["瘦子"],
      "summary": "不羡仙酒馆中的客人。主角在不羡仙酒馆与之相识。",
      "interpretation": null,
      "identity_tags": ["酒馆客人"],
      "faction_id": null,
      "importance": 3,
      "spoiler_level": 0,
      "first_appear_chapter_id": "chapter-qinghe",
      "visible_after_progress": "qinghe",
      "source_ids": ["src-baidu-pima"]
    },
    {
      "id": "liu-sanye",
      "slug": "liu-sanye",
      "name": "刘三爷",
      "aliases": ["敲钟人"],
      "summary": "不羡仙酒馆中的客人，第二篇中主角给他上酒。在将军祠相关剧情中也有出现。",
      "interpretation": null,
      "identity_tags": ["酒馆客人"],
      "faction_id": null,
      "importance": 2,
      "spoiler_level": 0,
      "first_appear_chapter_id": "chapter-qinghe",
      "visible_after_progress": "qinghe",